{
  "schemaVersion": "2.0",
  "modelId": "yolo/v6/detect/s",
  "name": "YOLOv6s Detect",
  "family": "yolov6",
  "task": "object-detection",
  "modelVersion": "s",
  "exporter": {
    "name": "audited-upstream-onnx-export",
    "version": "local-onnx-export",
    "sourceRevision": "e86a483f3f6bded25d45970b56831345a99744a4"
  },
  "source": {
    "sourceUrl": "https://github.com/meituan/YOLOv6/tree/e86a483f3f6bded25d45970b56831345a99744a4",
    "projectUrl": "https://github.com/meituan/YOLOv6",
    "revision": "e86a483f3f6bded25d45970b56831345a99744a4",
    "author": "Upstream YOLO maintainers",
    "licenseExpression": "GPL-3.0-only",
    "licenseFile": "bundle/source/licenses/gpl-yolo-family.txt",
    "redistributionAllowed": true
  },
  "generatedAt": "2026-08-17T00:00:00Z",
  "profileId": "yolo.detect.v6.raw-candidate-major.onnx.yolo/v6/detect/s",
  "inputs": [
    {
      "name": "images",
      "elementType": "float32",
      "shape": [
        1,
        3,
        640,
        640
      ]
    }
  ],
  "outputs": [
    {
      "name": "outputs",
      "elementType": "float32",
      "shape": [
        1,
        -1,
        85
      ]
    }
  ],
  "artifacts": [
    {
      "artifactId": "onnx.fp32",
      "format": "onnx",
      "locationKind": "directory",
      "entrypoint": "bundle",
      "compatibleBackends": [
        "onnxruntime",
        "openvino"
      ],
      "files": [
        {
          "relativePath": "bundle/model.onnx",
          "sha256": "f6fddae83fb23ff02578d5b5e9f4eb9d68b5d8e7f469bb80edf4041681c757f6",
          "size": 69046664,
          "mediaType": "application/onnx",
          "role": "model"
        },
        {
          "relativePath": "bundle/source/licenses/gpl-yolo-family.txt",
          "sha256": "3972dc9744f6499f0f9b2dbf76696f2ae7ad8af9b23dde66d6af86c9dfb36986",
          "size": 35149,
          "mediaType": "text/plain",
          "role": "license"
        }
      ],
      "precision": "fp32",
      "quantization": "none",
      "opset": 12,
      "portable": true,
      "extensions": {
        "deploysharp.validation-status": "local-backend-verified",
        "deploysharp.artifact-provenance": "unverified-local-file",
        "deploysharp.preprocessing-version": "ultralytics-letterbox-rgb-nchw-v1",
        "deploysharp.postprocessing-version": "deploysharp-yolo-detection-v1",
        "deploysharp.validation-image-sha256": "33b198a1d2839bb9ac4c65d61f9e852196793cae9a0781360859425f6022b69c",
        "deploysharp.prepared-tensor-sha256": "48af3a194d046f683585c8c8deffa953d415122ec0f2398bd27d8a67f34978df",
        "deploysharp.release-admission": "alpha-preview-redistributable-source-recorded"
      }
    }
  ],
  "extensions": {
    "deploysharp.publication-status": "alpha-preview",
    "deploysharp.downloadable": "true"
  }
}
