{
  "schemaVersion": "2.0", "modelId": "generative-vision-language/blip-caption-base/external", "name": "Salesforce BLIP base caption external two-graph bundle", "family": "blip", "task": "image-captioning", "modelVersion": "blip-056a1694-capfilt-large-opset17",
  "exporter": { "name": "salesforce-blip-plus-torch-onnx", "version": "torch-2.9.1-opset17-dynamo-false", "sourceRevision": "056a169437371659074aa2732649d5de3bffb4a8" },
  "source": { "sourceUrl": "https://storage.googleapis.com/sfr-vision-language-research/BLIP/models/model_base_caption_capfilt_large.pth", "projectUrl": "https://github.com/salesforce/BLIP", "revision": "056a169437371659074aa2732649d5de3bffb4a8", "author": "Salesforce Research", "licenseExpression": "BSD-3-Clause", "redistributionAllowed": false },
  "generatedAt": "2026-08-09T00:00:00Z", "profileId": "generative-vlm.blip.caption-base.opset17",
  "inputs": [{ "name": "pixel_values", "elementType": "float32", "shape": [-1,3,384,384] }, { "name": "input_ids", "elementType": "int64", "shape": [-1,-1] }, { "name": "attention_mask", "elementType": "int64", "shape": [-1,-1] }, { "name": "encoder_hidden_states", "elementType": "float32", "shape": [-1,577,768] }, { "name": "encoder_attention_mask", "elementType": "int64", "shape": [-1,577] }],
  "outputs": [{ "name": "encoder_hidden_states", "elementType": "float32", "shape": [-1,577,768] }, { "name": "logits", "elementType": "float32", "shape": [-1,-1,30524] }],
  "artifacts": [
    { "artifactId": "vision-encoder.onnx.fp32", "format": "onnx", "locationKind": "file", "entrypoint": "converted-opset17/vision_encoder.onnx", "compatibleBackends": ["onnxruntime","openvino"], "files": [
      { "relativePath": "converted-opset17/vision_encoder.onnx", "sha256": "304b912cc437706e2fd34a54cfde1d156134a08a437bc7f46a29d2ea7fa759ef", "size": 344502972, "mediaType": "application/onnx", "role": "model" },
      { "relativePath": "model_base_caption_capfilt_large.pth", "sha256": "96ac8749bd0a568c274ebe302b3a3748ab9be614c737f3d8c529697139174086", "size": 896081425, "mediaType": "application/octet-stream", "role": "weights" },
      { "relativePath": "converted-opset17/processor-contract.json", "sha256": "76aa309c203810ad36f1ce32132dde5dc3b9c89675a19c2933df36d7085c751c", "size": 356, "mediaType": "application/json", "role": "other" },
      { "relativePath": "converted-opset17/pixel_values.f32", "sha256": "ddac9a590723cbc09a442eacf0ae04cd1b4bf0f040e58ed3b906d1ceb5e3f288", "size": 1769472, "mediaType": "application/octet-stream", "role": "other" },
      { "relativePath": "converted-opset17/encoder_hidden_states.f32", "sha256": "4c7978221c54094bc5d4ce5f93b9ea481fb387609f350ec9a51281f11662e906", "size": 1772544, "mediaType": "application/octet-stream", "role": "other" }
    ], "precision": "fp32", "quantization": "none", "opset": 17, "portable": true, "extensions": { "deploysharp.bundle-role": "vision-encoder", "deploysharp.bundle-version": "blip-caption-base-056a1694-opset17", "deploysharp.capabilities": "image-captioning", "deploysharp.vision-backbone": "vit-base-patch16-384", "deploysharp.q-former-id": "none", "deploysharp.language-model-id": "bert-lm-head-30524", "deploysharp.tokenizer-id": "bert-base-uncased-blip-dec", "deploysharp.prompt-template-id": "blip-caption-a-picture-of-v1", "deploysharp.generation-config-id": "blip-caption-greedy-5-20-v1", "deploysharp.generation-mode": "greedy-full-prefix", "deploysharp.kv-cache-schema-id": "none-full-prefix-v1", "deploysharp.validation-status": "external-ort-openvino-official-golden-verified", "deploysharp.golden-summary": "official image state sha 4c797822...; exact official token sequence and caption", "deploysharp.release-admission": "blocked-external-only" } },
    { "artifactId": "language-decoder.onnx.fp32", "format": "onnx", "locationKind": "file", "entrypoint": "converted-opset17/text_decoder_full_prefix.onnx", "compatibleBackends": ["onnxruntime","openvino"], "files": [
      { "relativePath": "converted-opset17/text_decoder_full_prefix.onnx", "sha256": "56fcfa494c561f630b36bdf8ef62adc0597b559588995a73b56bdbab5604e686", "size": 645794706, "mediaType": "application/onnx", "role": "model" },
      { "relativePath": "bert-base-uncased-vocab.txt", "sha256": "07eced375cec144d27c900241f3e339478dec958f92fddbc551f295c992038a3", "size": 231508, "mediaType": "text/plain", "role": "other" },
      { "relativePath": "converted-opset17/generation-config.json", "sha256": "640f3443087a7ba7cf4e6819ca9c69379669b8556acc5c178cd0e121b2d74519", "size": 258, "mediaType": "application/json", "role": "other" },
      { "relativePath": "converted-opset17/generated_token_ids.i64", "sha256": "70e6d3910617617ebead3316aab4828a27bd315d1d8097d7e5d54370475b3ec1", "size": 120, "mediaType": "application/octet-stream", "role": "other" },
      { "relativePath": "converted-opset17/evidence.json", "sha256": "cec8cd963bc0f15de454bbc94b4cf2a27453e77fba0e19a0a456a39f77af64e1", "size": 5808, "mediaType": "application/json", "role": "other" },
      { "relativePath": "converted-opset17/deploysharp-evidence.json", "sha256": "824339d0f18723b28ed92e5d35cf0f53645843df624672893eee07d4dce6a080", "size": 1342, "mediaType": "application/json", "role": "other" }
    ], "precision": "fp32", "quantization": "none", "opset": 17, "portable": true, "extensions": { "deploysharp.bundle-role": "language-decoder", "deploysharp.bundle-version": "blip-caption-base-056a1694-opset17", "deploysharp.capabilities": "image-captioning", "deploysharp.vision-backbone": "vit-base-patch16-384", "deploysharp.q-former-id": "none", "deploysharp.language-model-id": "bert-lm-head-30524", "deploysharp.tokenizer-id": "bert-base-uncased-blip-dec", "deploysharp.prompt-template-id": "blip-caption-a-picture-of-v1", "deploysharp.generation-config-id": "blip-caption-greedy-5-20-v1", "deploysharp.generation-mode": "greedy-full-prefix", "deploysharp.kv-cache-schema-id": "none-full-prefix-v1", "deploysharp.validation-status": "external-ort-openvino-official-golden-verified", "deploysharp.release-admission": "blocked-external-only" } }
  ]
}
