{
  "schemaVersion": "2.0",
  "modelId": "yolo/v9/segment/c",
  "name": "YOLOv9c Segmentation",
  "family": "yolov9",
  "task": "instance-segmentation",
  "modelVersion": "c",
  "exporter": {
    "name": "Upstream YOLO ONNX export",
    "version": "local-pytorch2.2.1-export",
    "sourceRevision": "5b1ea9a8b3f0ffe4fe0e203ec6232d788bb3fcff"
  },
  "source": {
    "sourceUrl": "https://github.com/WongKinYiu/yolov9/tree/5b1ea9a8b3f0ffe4fe0e203ec6232d788bb3fcff",
    "projectUrl": "https://github.com/WongKinYiu/yolov9",
    "revision": "5b1ea9a8b3f0ffe4fe0e203ec6232d788bb3fcff",
    "author": "Upstream YOLO maintainers",
    "licenseExpression": "GPL-3.0-only",
    "licenseFile": "bundle/source/licenses/gpl-yolo-family.txt",
    "redistributionAllowed": true
  },
  "generatedAt": "2026-08-17T00:00:00Z",
  "profileId": "yolo.yolo.v9.segment.c",
  "inputs": [
    {
      "name": "images",
      "elementType": "float32",
      "shape": [
        1,
        3,
        640,
        640
      ]
    }
  ],
  "outputs": [],
  "artifacts": [
    {
      "artifactId": "onnx.fp32",
      "format": "onnx",
      "locationKind": "directory",
      "entrypoint": "bundle",
      "compatibleBackends": [
        "onnxruntime",
        "openvino"
      ],
      "files": [
        {
          "relativePath": "bundle/model.onnx",
          "sha256": "2cc4ea632009115d72f30841d7295d5ca064cc9697a2fb4efbea3ce41ac0a2a0",
          "size": 110001237,
          "mediaType": "application/onnx",
          "role": "model"
        },
        {
          "relativePath": "bundle/source/licenses/gpl-yolo-family.txt",
          "sha256": "3972dc9744f6499f0f9b2dbf76696f2ae7ad8af9b23dde66d6af86c9dfb36986",
          "size": 35149,
          "mediaType": "text/plain",
          "role": "license"
        }
      ],
      "precision": "fp32",
      "quantization": "none",
      "opset": 12,
      "portable": true,
      "extensions": {
        "deploysharp.validation-status": "local-ort-openvino-real-image-matrix-verified",
        "deploysharp.preprocessing-version": "ultralytics-letterbox-or-task-specific-v1",
        "deploysharp.postprocessing-contract": "attribute-major detection and prototype mask outputs",
        "deploysharp.release-admission": "alpha-preview-redistributable-source-recorded"
      }
    }
  ],
  "extensions": {
    "deploysharp.publication-status": "alpha-preview",
    "deploysharp.downloadable": "true"
  }
}
