{
  "schemaVersion": "2.0",
  "modelId": "rt-detr/r50vd-decoded-vector-ir",
  "name": "Paddle RT-DETR R50vd decoded vector-count OpenVINO IR",
  "family": "rt-detr",
  "task": "object-detection",
  "modelVersion": "r50vd-6x-coco-local-ir-external",
  "exporter": {
    "name": "OpenVINO-model-conversion",
    "version": "local-converter-unverified",
    "sourceRevision": "b25522a0f4bde8c80603f3ba5e3472059972e3b5"
  },
  "source": {
    "sourceUrl": "https://github.com/PaddlePaddle/PaddleDetection/tree/b25522a0f4bde8c80603f3ba5e3472059972e3b5",
    "projectUrl": "https://github.com/PaddlePaddle/PaddleDetection",
    "revision": "b25522a0f4bde8c80603f3ba5e3472059972e3b5",
    "author": "PaddlePaddle",
    "licenseExpression": "Apache-2.0",
    "licenseFile": "bundle/source/licenses/apache-paddledetection.txt",
    "redistributionAllowed": true
  },
  "generatedAt": "2026-08-17T00:00:00Z",
  "profileId": "portable.rtdetrdet.rt-detr/r50vd-decoded-vector-ir",
  "inputs": [
    {
      "name": "image",
      "elementType": "float32",
      "shape": [
        1,
        3,
        640,
        640
      ]
    },
    {
      "name": "im_shape",
      "elementType": "float32",
      "shape": [
        1,
        2
      ]
    },
    {
      "name": "scale_factor",
      "elementType": "float32",
      "shape": [
        1,
        2
      ]
    }
  ],
  "outputs": [
    {
      "name": "save_infer_model/scale_0.tmp_0",
      "elementType": "float32",
      "shape": [
        300,
        6
      ]
    },
    {
      "name": "save_infer_model/scale_1.tmp_0",
      "elementType": "int32",
      "shape": [
        1
      ]
    }
  ],
  "artifacts": [
    {
      "artifactId": "openvino-ir.fp32",
      "format": "openvino-ir",
      "locationKind": "directory",
      "entrypoint": "bundle",
      "compatibleBackends": [
        "openvino"
      ],
      "files": [
        {
          "relativePath": "bundle/model.xml",
          "sha256": "9d49703964c07567de7f00bda85bae1760da322e2b0655bfae110f2c222c778d",
          "size": 1556096,
          "mediaType": "application/xml",
          "role": "model"
        },
        {
          "relativePath": "bundle/model.bin",
          "sha256": "c4f2ea6021314c23d691e5d6911da0804191202d049f3927cfa242f181600455",
          "size": 85633634,
          "mediaType": "application/octet-stream",
          "role": "weights"
        },
        {
          "relativePath": "bundle/source/licenses/apache-paddledetection.txt",
          "sha256": "c71d239df91726fc519c6eb72d318ec65820627232b2f796219e87dcf35d0ab4",
          "size": 11357,
          "mediaType": "text/plain",
          "role": "license"
        }
      ],
      "precision": "mixed",
      "quantization": "none",
      "opset": 16,
      "portable": true,
      "extensions": {
        "deploysharp.validation-status": "local-openvino-real-image-field-verified",
        "deploysharp.preprocessing-version": "paddledetection-rgb-resize-div255-aux-v2",
        "deploysharp.postprocessing-version": "paddledetection-decoded-rows-vector-count-v2",
        "deploysharp.input-sha256": "33b198a1d2839bb9ac4c65d61f9e852196793cae9a0781360859425f6022b69c",
        "deploysharp.canonical-result-sha256": "0aa552a2931ff5431849a62d6461e7b828fbb6f3e456c48d96814840497bf7c9",
        "deploysharp.golden-summary": "bus.jpg strict-score-0.4 result-count-5; ORT/OpenVINO field parity within declared tolerance",
        "deploysharp.conversion-chain": "The published OpenVINO Runtime 2026.2.1 metadata exposes save_infer_model/scale_1.tmp_0 for the vector-count output.",
        "deploysharp.release-admission": "alpha-preview-redistributable-source-recorded"
      }
    }
  ],
  "extensions": {
    "deploysharp.publication-status": "alpha-preview",
    "deploysharp.downloadable": "true"
  }
}
