{
  "schemaVersion": "2.0", "modelId": "sam2/2.1/hiera-tiny-image-prompt/external", "name": "SAM 2.1 Hiera Tiny local external-data image bundle", "family": "sam2", "task": "promptable-image-segmentation", "modelVersion": "2.1-hiera-tiny-local-external",
  "exporter": { "name": "transformers-style-onnx-local-artifact", "version": "unverified", "sourceRevision": "2b90b9f5ceec907a1c18123530e92e794ad901a4" },
  "source": { "sourceUrl": "https://github.com/facebookresearch/sam2", "projectUrl": "https://github.com/facebookresearch/sam2", "revision": "local-artifact-checkpoint-export-unverified", "author": "Meta AI and external converter", "licenseExpression": "Apache-2.0", "redistributionAllowed": false },
  "generatedAt": "2026-08-08T00:00:00Z", "profileId": "promptable.sam2.2.1-hiera-tiny-local-external",
  "inputs": [ { "name": "pixel_values", "elementType": "float32", "shape": [-1,3,1024,1024] }, { "name": "input_points", "elementType": "float32", "shape": [-1,1,-1,2] }, { "name": "input_labels", "elementType": "int64", "shape": [-1,1,-1] }, { "name": "input_boxes", "elementType": "float32", "shape": [-1,-1,4] } ],
  "outputs": [ { "name": "iou_scores", "elementType": "float32", "shape": [-1,-1,3] }, { "name": "pred_masks", "elementType": "float32", "shape": [-1,-1,-1,256,256] }, { "name": "object_score_logits", "elementType": "float32", "shape": [-1,-1,1] } ],
  "artifacts": [
    { "artifactId": "image-encoder.onnx.fp32.external-data", "format": "onnx", "locationKind": "file", "entrypoint": "vision_encoder.onnx", "compatibleBackends": ["onnxruntime","openvino"], "files": [ { "relativePath": "vision_encoder.onnx", "sha256": "4f30aacd3aaefbca81a0b7fe4c1fc96345570ea0a6f80ced599493d1b3be2e8c", "size": 354238, "mediaType": "application/onnx", "role": "model" }, { "relativePath": "vision_encoder.onnx_data", "sha256": "e83df9866a5afe68ea7f0f721f18f65137fc3acbf0da1c74e946d363e09c69cc", "size": 134084864, "mediaType": "application/octet-stream", "role": "weights" } ], "precision": "fp32", "quantization": "none", "opset": 18, "portable": true, "extensions": { "deploysharp.bundle-role": "image-encoder", "deploysharp.required-sidecars": "vision_encoder.onnx_data", "deploysharp.validation-status": "local-ort-openvino-contract-only", "deploysharp.release-admission": "blocked-no-official-export-chain" } },
    { "artifactId": "prompt-mask-decoder.onnx.fp32.external-data", "format": "onnx", "locationKind": "file", "entrypoint": "prompt_encoder_mask_decoder.onnx", "compatibleBackends": ["onnxruntime","openvino"], "files": [ { "relativePath": "prompt_encoder_mask_decoder.onnx", "sha256": "874414704c5d686db7d206a35f6e15d26563d50c8c4468fccc6739bd7e491dcf", "size": 213114, "mediaType": "application/onnx", "role": "model" }, { "relativePath": "prompt_encoder_mask_decoder.onnx_data", "sha256": "e9874d900dd4134ed60eab1e97910327c2419e0b2954485d8fd6e7f1a1470f47", "size": 20958208, "mediaType": "application/octet-stream", "role": "weights" } ], "precision": "fp32", "quantization": "none", "opset": 18, "portable": true, "extensions": { "deploysharp.bundle-role": "prompt-mask-decoder", "deploysharp.required-sidecars": "prompt_encoder_mask_decoder.onnx_data", "deploysharp.validation-status": "local-ort-openvino-point-box-contract-only", "deploysharp.release-admission": "blocked-missing-mask-feedback-video-memory-and-official-export-chain" } }
  ]
}
