{
  "schemaVersion": "2.0",
  "modelId": "anomalib/padim/mvtec-bottle",
  "name": "Anomalib PaDiM MVTec AD bottle",
  "family": "anomalib-seg",
  "task": "anomaly-detection",
  "modelVersion": "mvtec-ad-bottle-pytorch-2.7.1-opset14",
  "exporter": {
    "name": "anomalib-to_onnx",
    "version": "pytorch-2.7.1-opset14",
    "sourceRevision": "ffde4cce3db38964f9cf627b524dd325401c6107"
  },
  "source": {
    "sourceUrl": "https://github.com/open-edge-platform/anomalib",
    "projectUrl": "https://github.com/open-edge-platform/anomalib",
    "revision": "ffde4cce3db38964f9cf627b524dd325401c6107",
    "author": "Anomalib maintainers",
    "licenseExpression": "Apache-2.0",
    "redistributionAllowed": true
  },
  "generatedAt": "2026-08-23T00:00:00Z",
  "profileId": "anomalib.padim.anomalib/padim/mvtec-bottle.opset14",
  "inputs": [
    { "name": "input", "elementType": "float32", "shape": [1, 3, 256, 256] }
  ],
  "outputs": [
    { "name": "pred_score", "elementType": "float32", "shape": [1, 1] },
    { "name": "pred_label", "elementType": "bool", "shape": [1, 1] },
    { "name": "anomaly_map", "elementType": "float32", "shape": [1, 1, 256, 256] },
    { "name": "pred_mask", "elementType": "bool", "shape": [1, 1, 256, 256] }
  ],
  "artifacts": [
    {
      "artifactId": "onnx.fp32",
      "format": "onnx",
      "locationKind": "file",
      "entrypoint": "model.onnx",
      "compatibleBackends": ["onnxruntime", "openvino"],
      "files": [
        { "relativePath": "model.onnx", "sha256": "bde19ca3086d3fa52bb3cbc2b9ea2d554ce1f10b4c8a8b38d7393bd54247ffff", "size": 176641352, "mediaType": "application/onnx", "role": "model" }
      ],
      "precision": "fp32",
      "quantization": "none",
      "opset": 14,
      "portable": true,
      "extensions": {
        "deploysharp.validation-status": "local-ort-openvino-four-output-contract-verified",
        "deploysharp.dataset": "MVTec AD / bottle",
        "deploysharp.preprocessing-version": "anomalib-export-transform-rgb-scale-v1",
        "deploysharp.prepared-tensor-sha256": "599c1bb5ffd4b87229a81958f33f1060821cd01cd7aa7ccafa0d862f4522f3f6",
        "deploysharp.postprocessing-version": "anomalib-four-output-probability-v1",
        "deploysharp.tile-semantics": "not-declared-by-artifact",
        "deploysharp.release-admission": "alpha-preview-direct-reproducibility-asset"
      }
    }
  ],
  "extensions": {
    "deploysharp.publication-status": "alpha-preview",
    "deploysharp.downloadable": "true",
    "deploysharp.release-tag": "models-20260903.visual.1",
    "deploysharp.release-repository": "guojin-yan/DeploySharp"
  }
}
