{
  "schemaVersion": "2.0",
  "modelId": "llm/qwen2.5-0.5b-instruct-q4-k-m/external",
  "name": "Qwen2.5 0.5B Instruct Q4_K_M authorized local GGUF",
  "family": "qwen2.5",
  "task": "language-generation-and-embedding",
  "modelVersion": "hf-9217f5db-q4-k-m",
  "exporter": {
    "name": "Qwen official GGUF publication",
    "version": "llama.cpp-compatible",
    "sourceRevision": "9217f5db79a29953eb74d5343926648285ec7e67"
  },
  "source": {
    "sourceUrl": "https://huggingface.co/Qwen/Qwen2.5-0.5B-Instruct-GGUF/resolve/9217f5db79a29953eb74d5343926648285ec7e67/qwen2.5-0.5b-instruct-q4_k_m.gguf",
    "projectUrl": "https://huggingface.co/Qwen/Qwen2.5-0.5B-Instruct-GGUF/tree/9217f5db79a29953eb74d5343926648285ec7e67",
    "revision": "9217f5db79a29953eb74d5343926648285ec7e67",
    "author": "Qwen Team / Alibaba Cloud",
    "copyright": "Copyright holders identified by the upstream Apache-2.0 distribution",
    "licenseExpression": "Apache-2.0",
    "licenseFile": "source/LICENSE",
    "redistributionAllowed": false
  },
  "generatedAt": "2026-08-10T00:00:00Z",
  "profileId": "llm.qwen2.5-0.5b-instruct.q4-k-m.external",
  "inputs": [
    { "name": "prompt", "elementType": "utf8-text", "shape": [] }
  ],
  "outputs": [
    { "name": "generated_text", "elementType": "utf8-text", "shape": [] },
    { "name": "embedding", "elementType": "float32", "shape": [-1] }
  ],
  "artifacts": [
    {
      "artifactId": "qwen2.5-0.5b-instruct.q4-k-m.gguf",
      "format": "gguf",
      "locationKind": "file",
      "entrypoint": "qwen2.5-0.5b-instruct-q4_k_m.gguf",
      "compatibleBackends": ["llamasharp"],
      "files": [
        {
          "relativePath": "qwen2.5-0.5b-instruct-q4_k_m.gguf",
          "sha256": "74a4da8c9fdbcd15bd1f6d01d621410d31c6fc00986f5eb687824e7b93d7a9db",
          "size": 491400032,
          "mediaType": "application/octet-stream",
          "role": "model"
        },
        {
          "relativePath": "source/config.json",
          "sha256": "18e18afcaccafade98daf13a54092927904649e1dd4eba8299ab717d5d94ff45",
          "size": 659,
          "mediaType": "application/json",
          "role": "configuration"
        },
        {
          "relativePath": "source/generation_config.json",
          "sha256": "e558847a8b4402616f1273797b015104dc266fe4b520056fca88823ba8f8ebe6",
          "size": 242,
          "mediaType": "application/json",
          "role": "configuration"
        },
        {
          "relativePath": "source/tokenizer_config.json",
          "sha256": "5b5d4f65d0acd3b2d56a35b56d374a36cbc1c8fa5cf3b3febbbfabf22f359583",
          "size": 7305,
          "mediaType": "application/json",
          "role": "tokenizer"
        },
        {
          "relativePath": "source/LICENSE",
          "sha256": "832dd9e00a68dd83b3c3fb9f5588dad7dcf337a0db50f7d9483f310cd292e92e",
          "size": 11343,
          "mediaType": "text/plain",
          "role": "license"
        },
        {
          "relativePath": "source/README.gguf.md",
          "sha256": "fa1fede7f775a20f111cc098c00900092020572ce78976970a5b0ad9ca211999",
          "size": 4856,
          "mediaType": "text/markdown",
          "role": "other"
        }
      ],
      "precision": "mixed-integer",
      "quantization": "q4-k-m",
      "portable": false,
      "minimumBackendVersion": "0.27.0",
      "minimumRuntimeVersion": "llama.cpp-3f7c29d318e317b63f54c558bc69803963d7d88c",
      "extensions": {
        "deploysharp.bundle-role": "authorized-local-external-gguf",
        "deploysharp.validation-status": "source-integrity-and-runtime-evidence-verified-local-external",
        "deploysharp.blocker": "Local-only authorization does not grant publication or official catalog admission.",
        "deploysharp.model-path": "E:\\DeploySharp-Models\\qwen2.5-0.5b-instruct-q4_k_m\\qwen2.5-0.5b-instruct-q4_k_m.gguf",
        "deploysharp.model-file-size": "491400032",
        "deploysharp.model-sha256": "74a4da8c9fdbcd15bd1f6d01d621410d31c6fc00986f5eb687824e7b93d7a9db",
        "deploysharp.context-length": "32768",
        "deploysharp.bos-eos-pad": "GGUF runtime metadata bos=151643 <|endoftext|>; eos=151645 <|im_end|>; pad=151643 <|endoftext|>; add_bos=false",
        "deploysharp.tokenizer-identity": "GGUF runtime tokenizer model=gpt2 pre=qwen2 vocab=151936 merges=151387; upstream tokenizer_config revision 7ae557604adf67be50417f59c2c2f167def9a775",
        "deploysharp.chat-template-identity": "GGUF runtime tokenizer.chat_template equals Qwen ChatML template; upstream tokenizer_config revision 7ae557604adf67be50417f59c2c2f167def9a775",
        "deploysharp.generation-identity": "generation_config.json at 7ae557604adf67be50417f59c2c2f167def9a775: temperature=0.7 top_p=0.8 top_k=20 do_sample=true max generation 8192",
        "deploysharp.embedding-capability": "supported; LLamaSharp mean-pooled embedding dimension 896",
        "deploysharp.license-status": "Apache-2.0 license file verified; user authorized local CPU testing only; no upload or publication authorization",
        "deploysharp.llamasharp-version": "0.27.0",
        "deploysharp.native-runtime-package": "LLamaSharp.Backend.Cpu",
        "deploysharp.native-runtime-version": "0.27.0",
        "deploysharp.runtime-evidence-path": "E:\\DeploySharp-Models\\qwen2.5-0.5b-instruct-q4_k_m\\evidence\\deploysharp-stage31-runtime.json",
        "deploysharp.runtime-evidence-sha256": "68f2b1e144c3d4537cb2f7c91473554296bda97a52bc5e5b5e9517dfb0dfc973",
        "deploysharp.runtime-evidence-operations": "cpu-generate,stream,cancel,repeat,contention,dispose,embedding",
        "deploysharp.executable": "true"
      }
    }
  ],
  "extensions": {
    "deploysharp.algorithm-verified": "false",
    "deploysharp.uploaded": "false",
    "deploysharp.downloadable": "false",
    "deploysharp.redistribution-allowed": "false",
    "deploysharp.execution-status": "external-runtime-evidence-complete",
    "deploysharp.stage31-admission-status": "admitted-external-local-only",
    "deploysharp.authorization-scope": "local CPU admission only; no upload or publication",
    "deploysharp.native-runtime": "LLamaSharp 0.27.0 with LLamaSharp.Backend.Cpu 0.27.0"
  }
}
