{
  "schemaVersion": "2.0",
  "modelId": "yolo/v8/pose/s",
  "name": "YOLOv8s Pose",
  "family": "yolov8",
  "task": "pose-estimation",
  "modelVersion": "s-8.1.6",
  "exporter": {
    "name": "Upstream YOLO ONNX export",
    "version": "8.1.6",
    "sourceRevision": "ef141af4b837e0a1c34ff187ac40ef36af56c135"
  },
  "source": {
    "sourceUrl": "https://github.com/ultralytics/ultralytics/tree/ef141af4b837e0a1c34ff187ac40ef36af56c135",
    "projectUrl": "https://github.com/ultralytics/ultralytics",
    "revision": "ef141af4b837e0a1c34ff187ac40ef36af56c135",
    "author": "Upstream YOLO maintainers",
    "licenseExpression": "AGPL-3.0-only",
    "licenseFile": "bundle/source/licenses/agpl-ultralytics.txt",
    "redistributionAllowed": true
  },
  "generatedAt": "2026-08-17T00:00:00Z",
  "profileId": "yolo.yolo.v8.pose.s",
  "inputs": [
    {
      "name": "images",
      "elementType": "float32",
      "shape": [
        1,
        3,
        640,
        640
      ]
    }
  ],
  "outputs": [],
  "artifacts": [
    {
      "artifactId": "onnx.fp32",
      "format": "onnx",
      "locationKind": "directory",
      "entrypoint": "bundle",
      "compatibleBackends": [
        "onnxruntime",
        "openvino"
      ],
      "files": [
        {
          "relativePath": "bundle/model.onnx",
          "sha256": "253504de521c91115afba4dcee4c77d23a7a0a87b8f8101b170d6cae4f9c302b",
          "size": 46787174,
          "mediaType": "application/onnx",
          "role": "model"
        },
        {
          "relativePath": "bundle/source/licenses/agpl-ultralytics.txt",
          "sha256": "0d96a4ff68ad6d4b6f1f30f713b18d5184912ba8dd389f86aa7710db079abcb0",
          "size": 34523,
          "mediaType": "text/plain",
          "role": "license"
        }
      ],
      "precision": "fp32",
      "quantization": "none",
      "opset": 17,
      "portable": true,
      "extensions": {
        "deploysharp.validation-status": "local-ort-openvino-real-image-matrix-verified",
        "deploysharp.preprocessing-version": "ultralytics-letterbox-or-task-specific-v1",
        "deploysharp.postprocessing-contract": "attribute-major boxes plus 17-keypoint pose output",
        "deploysharp.release-admission": "alpha-preview-redistributable-source-recorded"
      }
    }
  ],
  "extensions": {
    "deploysharp.publication-status": "alpha-preview",
    "deploysharp.downloadable": "true"
  }
}
