{
  "schemaVersion": "2.0",
  "modelId": "paddleocr/ppocrv5/mobile-det",
  "name": "PP-OCRv5 mobile text detector",
  "family": "paddle-ocr-det",
  "task": "text-detection",
  "modelVersion": "PP-OCRv5-mobile-det-release",
  "exporter": {
    "name": "PaddlePaddle official Hugging Face ONNX",
    "version": "official-huggingface-revision",
    "sourceRevision": "e6f4fa85f00e168c862bc462aebca69eef9b3d3d"
  },
  "source": {
    "sourceUrl": "https://huggingface.co/PaddlePaddle/PP-OCRv5_mobile_det_onnx/resolve/e6f4fa85f00e168c862bc462aebca69eef9b3d3d/inference.onnx",
    "projectUrl": "https://github.com/PaddlePaddle/PaddleOCR",
    "revision": "sha256:a431985659dc921974177a95adcfbb90fd9e51989a5e04d70d0b75f597b6e61d",
    "author": "PaddlePaddle",
    "licenseExpression": "Apache-2.0",
    "licenseFile": "bundle/source/licenses/paddleocr.LICENSE.txt",
    "redistributionAllowed": true
  },
  "generatedAt": "2026-08-18T00:00:00Z",
  "profileId": "paddle-ocr-det.paddleocr/ppocrv5/mobile-det.opset11",
  "inputs": [
    {
      "name": "x",
      "elementType": "float32",
      "shape": [
        1,
        3,
        -1,
        -1
      ]
    }
  ],
  "outputs": [
    {
      "name": "fetch_name_0",
      "elementType": "float32",
      "shape": [
        1,
        1,
        -1,
        -1
      ]
    }
  ],
  "artifacts": [
    {
      "artifactId": "onnx.fp32",
      "format": "onnx",
      "locationKind": "directory",
      "entrypoint": "bundle",
      "compatibleBackends": [
        "onnxruntime",
        "openvino"
      ],
      "files": [
        {
          "relativePath": "bundle/model.onnx",
          "sha256": "a431985659dc921974177a95adcfbb90fd9e51989a5e04d70d0b75f597b6e61d",
          "size": 4826518,
          "mediaType": "application/onnx",
          "role": "model"
        },
        {
          "relativePath": "bundle/source/licenses/paddleocr.LICENSE.txt",
          "sha256": "3840c5c0c61c294264d2dd77b8777be6ddd90121ef4e0e64abcd22edea581d6e",
          "size": 11376,
          "mediaType": "text/plain",
          "role": "license"
        }
      ],
      "precision": "fp32",
      "quantization": "none",
      "opset": 11,
      "portable": true,
      "extensions": {
        "deploysharp.validation-status": "official-upstream-onnx-source;runtime-golden-refresh-required",
        "deploysharp.artifact-provenance": "official-paddlepaddle-huggingface-onnx",
        "deploysharp.official-onnx-sha256": "a431985659dc921974177a95adcfbb90fd9e51989a5e04d70d0b75f597b6e61d",
        "deploysharp.release-admission": "alpha-preview-official-source-runtime-golden-refresh-required",
        "deploysharp.official-onnx-revision": "e6f4fa85f00e168c862bc462aebca69eef9b3d3d",
        "deploysharp.export-reproducibility": "not-applicable-official-onnx-download"
      }
    }
  ],
  "extensions": {
    "deploysharp.publication-status": "alpha-preview",
    "deploysharp.downloadable": "true",
    "deploysharp.release-tag": "models-visual.1",
    "deploysharp.release-repository": "guojin-yan/DeploySharp"
  }
}
